編號,資料集名稱,資料來源(部會單位),第一層級,第二層級,第三層級,資料量,下載次數,瀏覽次數,主要欄位
668,104年臺中市花卉生產概況,農業局,臺中市政府,農業局,,,,,臺中市花卉生產概況
669,104年臺中市舉發違反高速公路及快速公路管制規定成果,交通局,臺中市政府,交通局,,,,,車種、違規事項
670,104年臺中市舉發違反道路交通管理事件成果,臺中市警察局,臺中市政府,臺中市警察局,,,,,臺中市舉發違反道路交通管理事件成果
671,104年臺中市義勇消防人員人數,消防局,臺中市政府,消防局,,,,,臺中市義勇消防人員人數
672,104年臺中市縱火案件分析,消防局,臺中市政府,消防局,,,,,臺中市縱火案件分析
673,104年臺中市經濟案件,臺中市警察局,臺中市政府,臺中市警察局,,,,,臺中市經濟案件
674,104年臺中市統計年報-農林漁牧類,臺中市政府主計處‧第三科第一股,臺中市政府,主計處,第三科第一股,,,,104年臺中市統計年報-農林漁牧類
675,104年臺中市統計年報-財政金融類,臺中市政府主計處‧第三科第一股,臺中市政府,主計處,第三科第一股,,,,104年臺中市統計年報-財政金融類
676,104年臺中市統計年報-社會福利類,臺中市政府主計處‧第三科第一股,臺中市政府,主計處,第三科第一股,,,,104年臺中市統計年報-社會福利類
677,104年臺中市統計年報-教育文化類,臺中市政府主計處‧第三科第一股,臺中市政府,主計處,第三科第一股,,,,104年臺中市統計年報-教育文化類
678,104年臺中市統計年報-政府服務類,臺中市政府主計處‧第三科第一股,臺中市政府,主計處,第三科第一股,,,,104年臺中市統計年報-政府服務類
679,104年臺中市統計年報-工商經濟類,臺中市政府主計處‧第三科第一股,臺中市政府,主計處,第三科第一股,,,,104年臺中市統計年報-工商經濟類
680,104年臺中市統計年報-婚育概況類,臺中市政府主計處‧第三科第一股,臺中市政府,主計處,第三科第一股,,,,104年臺中市統計年報-婚育概況類
681,104年臺中市統計年報-土地類,臺中市政府主計處‧第三科第一股,臺中市政府,主計處,第三科第一股,,,,104年臺中市統計年報-土地類
682,104年臺中市統計年報-勞動就業類,臺中市政府主計處‧第三科第一股,臺中市政府,主計處,第三科第一股,,,,104年臺中市統計年報-勞動就業類
683,104年臺中市統計年報-公共建設類,臺中市政府主計處‧第三科第一股,臺中市政府,主計處,第三科第一股,,,,104年臺中市統計年報-公共建設類
684,104年臺中市統計年報-人口類,臺中市政府主計處‧第三科第一股,臺中市政府,主計處,第三科第一股,,,,104年臺中市統計年報-人口類
685,104年臺中市統計年報-交通運輸類,臺中市政府主計處‧第三科第一股,臺中市政府,主計處,第三科第一股,,,,104年臺中市統計年報-交通運輸類
686,104年臺中市立公共圖書館概況,文化局,臺中市政府,文化局,,,,,臺中市立公共圖書館概況
687,104年臺中市稻米生產概況,農業局,臺中市政府,農業局,,,,,臺中市稻米生產概況
688,104年臺中市監視錄影系統建置、列管情形,臺中市警察局,臺中市政府,臺中市警察局,,,,,臺中市監視錄影系統建置、列管情形
689,104年臺中市環境檢驗樣品分類統計,環保局,臺中市政府,環保局,,,,,臺中市環境檢驗樣品分類統計
690,104年臺中市環境影響評估案件統計,環保局,臺中市政府,環保局,,,,,臺中市環境影響評估案件統計
691,104年臺中市現有農機數,農業局,臺中市政府,農業局,,,,,臺中市現有農機數
692,104年臺中市現有漁筏數量,農業局,臺中市政府,農業局,,,,,臺中市現有漁筏數量
693,104年臺中市現有動力漁船數─按漁業別分,農業局,臺中市政府,農業局,,,,,臺中市現有動力漁船數─按漁業別分
694,104年臺中市特用作物生產概況,農業局,臺中市政府,農業局,,,,,臺中市特用作物生產概況
695,104年臺中市爆竹煙火違法取締,消防局,臺中市政府,消防局,,,,,臺中市爆竹煙火違法取締
696,104年臺中市爆竹煙火違法取締,消防局,臺中市政府,消防局,,,,,臺中市爆竹煙火違法取締
697,104年臺中市爆竹煙火安全檢查,消防局,臺中市政府,消防局,,,,,臺中市爆竹煙火安全檢查
698,104年臺中市爆竹煙火安全檢查,消防局,臺中市政府,消防局,,,,,臺中市爆竹煙火安全檢查
699,104年臺中市火災次數按起火處所分,消防局,臺中市政府,消防局,,,,,臺中市火災次數按起火處所分
700,104年臺中市火災次數按起火原因分,消防局,臺中市政府,消防局,,,,,臺中市火災次數按起火原因分
701,104年臺中市火災出動人員、車輛、船艇、直升機,消防局,臺中市政府,消防局,,,,,臺中市火災出動人員、車輛、船艇、直升機
702,104年臺中市火災人員死傷、財物損失,消防局,臺中市政府,消防局,,,,,臺中市火災人員死傷、財物損失
703,104年臺中市漁戶數及漁戶人口數,農業局,臺中市政府,農業局,,,,,臺中市漁戶數及漁戶人口數
704,104年臺中市液化石油氣消防安全檢查及違規取締,消防局,臺中市政府,消防局,,,,,臺中市液化石油氣消防安全檢查及違規取締
705,104年臺中市液化石油氣消防安全檢查及違規取締,消防局,臺中市政府,消防局,,,,,臺中市液化石油氣消防安全檢查及違規取締
706,104年臺中市液化石油氣消防安全檢查,消防局,臺中市政府,消防局,,,,,臺中市液化石油氣消防安全檢查
707,104年臺中市消防車輛裝備,消防局,臺中市政府,消防局,,,,,臺中市消防車輛裝備
708,104年臺中市消防緊急救護服務,消防局,臺中市政府,消防局,,,,,臺中市消防緊急救護服務
709,104年臺中市消防安全設備檢修申報,消防局,臺中市政府,消防局,,,,,臺中市消防安全設備檢修申報
710,104年臺中市消防安全設備查察處理,消防局,臺中市政府,消防局,,,,,臺中市消防安全設備查察處理
711,104年臺中市污水下水道系統污染管制情形,環保局,臺中市政府,環保局,,,,,臺中市污水下水道系統污染管制情形
712,104年臺中市水肥清運處理狀況,環保局,臺中市政府,環保局,,,,,臺中市水肥清運處理狀況
713,104年臺中市水產養殖面積─按魚類別分,農業局,臺中市政府,農業局,,,,,臺中市水產養殖面積─按魚類別分
714,104年臺中市水患災害人員傷亡、建物損失,消防局,臺中市政府,消防局,,,,,104年臺中市水患災害人員傷亡、建物損失
715,104年臺中市民宿業查報及取締情形,觀光旅遊局,臺中市政府,觀光旅遊局,,,,,臺中市民宿業查報及取締情形
716,104年臺中市橋梁維護工程,建設局,臺中市政府,建設局,,,,,臺中市橋梁維護工程
717,104年臺中市核發街頭藝人證概況,文化局,臺中市政府,文化局,,,,,臺中市核發街頭藝人證概況
718,104年臺中市核發建築物使用執照統計-按高度別分,都市發展局,臺中市政府,都市發展局,,,,,臺中市核發建築物使用執照統計-按高度別分
719,104年臺中市核發建築物使用執照統計-按用途別分,都市發展局,臺中市政府,都市發展局,,,,,核發建築物使用執照統計-按用途別分
720,104年臺中市核發建築物使用執照統計-按層數別分,都市發展局,臺中市政府,都市發展局,,,,,核發建築物使用執照統計-按用途別分
721,104年臺中市核發建築物使用執照統計-按土地使用分區別分,都市發展局,臺中市政府,都市發展局,,,,,核發建築物使用執照統計
722,104年臺中市查處涉嫌色情行為廣告成果,臺中市警察局,臺中市政府,臺中市警察局,,,,,臺中市查處涉嫌色情行為廣告成果
723,104年臺中市查獲毒品嫌疑犯人數-犯罪方法別、教育程度別,臺中市警察局,臺中市政府,臺中市警察局,,,,,臺中市查獲毒品嫌疑犯人數-犯罪方法別、教育程度別
724,104年臺中市查獲毒品嫌疑犯人數-犯罪方法別、教育程度別,臺中市警察局,臺中市政府,臺中市警察局,,,,,臺中市查獲毒品嫌疑犯人數-犯罪方法別、教育程度別
725,104年臺中市查獲侵害智慧財產權案件,臺中市警察局,臺中市政府,臺中市警察局,,,,,臺中市查獲侵害智慧財產權案件
726,104年臺中市查(核)定開徵數情形,地方稅務局,臺中市政府,地方稅務局,,,,,臺中市查(核)定開徵數情形
727,104年臺中市果品生產概況,農業局,臺中市政府,農業局,,,,,臺中市果品生產概況
728,104年臺中市林業(伐木業)生產成本,農業局,臺中市政府,農業局,,,,,臺中市林業(伐木業)生產成本
729,104年臺中市本土登革熱病例數,臺中市政府衛生局,臺中市政府,衛生局,,,,,"編號,發病日,區別,里別,道路名稱,緯度座標,經度座標"
730,104年臺中市未辦繼承登記土地建物列冊管理,地政局,臺中市政府,地政局,,,,,臺中市未辦繼承登記土地建物列冊管理
731,104年臺中市有機農作物栽培概況,農業局,臺中市政府,農業局,,,,,臺中市有機農作物栽培概況
732,104年臺中市旅館業及民宿業營運報告表,觀光旅遊局,臺中市政府,觀光旅遊局,,,,,臺中市旅館業及民宿業營運報告表
733,104年臺中市旅遊服務中心旅客諮詢人數統計表,觀光旅遊局,臺中市政府,觀光旅遊局,,,,,臺中市旅遊服務中心旅客諮詢人數統計表
734,104年臺中市政府財政局抽檢菸酒業者情形,財政局,臺中市政府,財政局,,,,,臺中市政府財政局抽檢菸酒業者情形
735,104年臺中市政府警察局處理涉外治安案件-分局別(嫌疑犯),臺中市警察局,臺中市政府,臺中市警察局,,,,,臺中市政府警察局處理涉外治安案件-分局別(嫌疑犯)
736,104年臺中市政府警察局受(處)理婦幼安全事(案)件,臺中市警察局,臺中市政府,臺中市警察局,,,,,臺中市政府警察局受(處)理婦幼安全事(案)件
737,104年臺中市政府警察局受(處)理婦幼安全事(案)件,臺中市警察局,臺中市政府,臺中市警察局,,,,,臺中市政府警察局受(處)理婦幼安全事(案)件
738,104年臺中市政府現有停車位概況─建築物附設停車空間部分,交通局,臺中市政府,交通局,,,,,臺中市政府現有停車位概況─建築物附設停車空間部分
739,104年臺中市政府核發建築物建造及拆除執照,都市發展局,臺中市政府,都市發展局,,,,,核發建築物建造執照統計-按用途別分、按構造別分
740,104年臺中市政府政風處預防工作績效統計,政風處,臺中市政府,政風處,,,,,臺中市政府政風處預防工作績效統計
741,104年臺中市政府免費無線網路服務統計表,資訊中心,臺中市政府,,,,,,臺中市政府免費無線網路服務統計表
742,104年臺中市政府一級機關一般公文統計表,資訊中心,臺中市政府,,,,,,一級機關一般公文統計表-發文平均日數
743,104年臺中市所得收入者平均每人所得分配按職業別分,臺中市政府主計處第四科,臺中市政府,主計處,第四科,,,,臺中市所得收入者平均每人所得分配按職業別分
744,104年臺中市所得收入者平均每人所得分配按性別分,臺中市政府主計處第四科,臺中市政府,主計處,第四科,,,,104年臺中市所得收入者平均每人所得分配按性別分
745,104年臺中市房屋稅籍,地方稅務局,臺中市政府,地方稅務局,,,,,臺中市房屋稅籍
746,104年臺中市建築物開工統計-按用途別分,都市發展局,臺中市政府,都市發展局,,,,,臺中市建築物開工統計-按用途別分
747,104年臺中市建築物開工統計-按構造別分,都市發展局,臺中市政府,都市發展局,,,,,臺中市建築物開工統計-按構造別分
748,104年臺中市建築師開業家數及人數,都發局,臺中市政府,都發局,,,,,建築師開業家數及人數
749,104年臺中市平均每戶家庭收支概況,臺中市政府主計處第四科,臺中市政府,主計處,第四科,,,,104年臺中市平均每戶家庭所得收入、非消費支出及消費支出之金額。
750,104年臺中市平均每戶家庭收支按經濟戶長職業別分,臺中市政府主計處第四科,臺中市政府,主計處,第四科,,,,臺中市平均每戶家庭收支按經濟戶長職業別分
751,104年臺中市平均每戶家庭收支按經濟戶長性別分,臺中市政府主計處第四科,臺中市政府,主計處,第四科,,,,臺中市平均每戶家庭收支按經濟戶長性別分
752,104年臺中市市道公路養護工程成果,建設局,臺中市政府,建設局,,,,,臺中市市道公路養護工程成果
753,104年臺中市市區公車行車肇事案件,交通局,臺中市政府,交通局,,,,,市區公車行車肇事案件-死亡總人數、市區公車行車肇事案件-肇事件數、市區公車行車肇事案件-總行駛里、市區公車行車肇事案件-受傷總人數
754,104年臺中市市區公車業務概況及行車情形－按公司別,交通局,臺中市政府,交通局,,,,,市區公車業務概況及行車情形
755,104年臺中市市區公車智慧卡交易量,交通局,臺中市政府,交通局,,,,,市區公車智慧卡交易量-交易筆數
756,104年臺中市已開闢公園、綠地、兒童遊樂場、廣場、河濱公園座數面積,建設局,臺中市政府,建設局,,,,,臺中市已開闢公園、綠地、兒童遊樂場、廣場、河濱公園座數面積
757,104年臺中市已登記公私有土地筆數面積 (按區別),臺中市政府地政局‧地籍科,臺中市政府,地政局,地籍科,,,,"公有,私有,公私共有土地筆數及面積"
758,104年臺中市巨大垃圾統計,環保局,臺中市政府,環保局,,,,,臺中市巨大垃圾統計
759,104年臺中市巨大垃圾統計,環保局,臺中市政府,環保局,,,,,臺中市巨大垃圾統計
760,104年臺中市少年(兒童)犯罪狀況,警察局,臺中市政府,警察局,,,,,臺中市少年(兒童)犯罪狀況
761,104年臺中市家庭戶數按經濟戶長性別及所得總額組別分,臺中市政府主計處第四科,臺中市政府,主計處,第四科,,,,臺中市家庭戶數按經濟戶長性別及所得總額組別分
762,104年臺中市家庭住宅及現代化設備概況,臺中市政府主計處第四科,臺中市政府,主計處,第四科,,,,104年臺中市家庭住宅概況、各現代化設備普及率及擁有數量。
763,104年臺中市宗教財團法人概況,民政局,臺中市政府,民政局,,,,,臺中市宗教財團法人概況
764,104年臺中市孔蓋下地數量,建設局,臺中市政府,建設局,,,,,臺中市孔蓋下地數量
765,104年臺中市失蹤人口,臺中市警察局,臺中市政府,臺中市警察局,,,,,臺中市失蹤人口
766,104年臺中市大坑風景區各登山步道遊客數,觀光旅遊局,臺中市政府,觀光旅遊局,,,,,臺中市大坑風景區各登山步道遊客數
767,104年臺中市垃圾處理場(廠)及垃圾清理車輛與機具,環保局,臺中市政府,環保局,,,,,臺中市垃圾處理場(廠)及垃圾清理車輛與機具
768,104年臺中市垃圾處理場(廠)及垃圾回收清除車輛統計,環保局,臺中市政府,環保局,,,,,臺中市垃圾處理場(廠)及垃圾回收清除車輛統計
769,104年臺中市垃圾清理狀況,環保局,臺中市政府,環保局,,,,,臺中市垃圾清理狀況
770,104年臺中市地方稅網路與臨櫃申報件數統計表,地方稅務局,臺中市政府,地方稅務局,,,,,臺中市地方稅網路與臨櫃申報件數統計表
771,104年臺中市地政士開業及異動,地政局,臺中市政府,地政局,,,,,臺中市地政士開業及異動
772,104年臺中市土地建物登記管理,臺中市政府地政局‧地籍科,臺中市政府,地政局,地籍科,,,,"件數,土地筆數,土地面積,建物筆數,建物面積"
773,104年臺中市國民小學補習學校原住民學生數,教育局,臺中市政府,教育局,,,,,臺中市國民小學補習學校原住民學生數
774,104年臺中市國民小學校數按班級數、學生數別分,教育局,臺中市政府,教育局,,,,,臺中市國民小學校數按班級數、學生數別分
775,104年臺中市國民小學新移民子女學生數,教育局,臺中市政府,教育局,,,,,臺中市國民小學新移民子女學生數
776,104年臺中市國民小學學生裸眼視力檢查,教育局,臺中市政府,教育局,,,,,臺中市國民小學學生裸眼視力檢查
777,104年臺中市國民小學僑生及港澳學生數,教育局,臺中市政府,教育局,,,,,臺中市國民小學僑生及港澳學生數
778,104年臺中市國民小學中途輟學學生概況-行政區別,教育局,臺中市政府,教育局,,,,,臺中市國民小學中途輟學學生概況-行政區別
779,104年臺中市國民中學校數按班級數、學生數別分,教育局,臺中市政府,教育局,,,,,臺中市國民中學校數按班級數、學生數別分
780,104年臺中市國民中學新移民子女學生數,教育局,臺中市政府,教育局,,,,,臺中市國民中學新移民子女學生數
781,104年臺中市國民中學學生裸眼視力檢查,教育局,臺中市政府,教育局,,,,,臺中市國民中學學生裸眼視力檢查
782,104年臺中市國民中學中途輟學學生概況-行政區別,教育局,臺中市政府,教育局,,,,,臺中市國民中學中途輟學學生概況-行政區別
783,104年臺中市國小圖書館統計,文化局,臺中市政府,文化局,,,,,臺中市國小圖書館統計
784,104年臺中市國中圖書館統計,文化局,臺中市政府,文化局,,,,,臺中市國中圖書館統計
785,104年臺中市商業登記異動,經濟發展發局,臺中市政府,經濟發展發局,,,,,臺中市商業登記異動
786,104年臺中市商業登記現有家數及資本額－按行業別及行政區別分,經濟發展發局,臺中市政府,經濟發展發局,,,,,臺中市商業登記現有家數及資本額－按行業別及行政區別分
787,104年臺中市商業登記家數及資本額異動,經濟發展發局,臺中市政府,經濟發展發局,,,,,臺中市商業登記家數及資本額異動
788,104年臺中市合作社概況,社會局,臺中市政府,社會局,,,,,臺中市合作社概況
789,104年臺中市合作事業現有工作人員,社會局,臺中市政府,社會局,,,,,臺中市合作事業現有工作人員
790,104年臺中市各項預防接種工作量統計,衛生局,臺中市政府,衛生局,,,,,臺中市各項預防接種工作量統計
791,104年臺中市各級學校學生人數,教育局,臺中市政府,教育局,,,,,臺中市各級學校學生人數
792,104年臺中市各級學校學生人數,教育局,臺中市政府,教育局,,,,,臺中市各級學校學生人數
793,104年臺中市各級古蹟概況,文化局,臺中市政府,文化局,,,,,臺中市各級古蹟概況
794,104年臺中市取締酒駕情形,臺中市警察局,臺中市政府,臺中市警察局,,,,,臺中市取締酒駕情形
795,104年臺中市取締賭博性電動玩具成果,臺中市警察局,臺中市政府,臺中市警察局,,,,,臺中市取締賭博性電動玩具成果
796,104年臺中市印花稅徵收,地方稅務局,臺中市政府,地方稅務局,,,,,臺中市印花稅徵收
797,104年臺中市區道公路養護工程成果,建設局,臺中市政府,建設局,,,,,臺中市區道公路養護工程成果
798,104年臺中市勞工教育概況,勞工局,臺中市政府,勞工局,,,,,臺中市勞工教育概況
799,104年臺中市勞工志願服務概況,勞工局,臺中市政府,勞工局,,,,,臺中市勞工志願服務概況
800,104年臺中市勞工大學服務概況,勞工局,臺中市政府,勞工局,,,,,臺中市勞工大學服務概況
801,104年臺中市動物疾病檢驗件數統計,農業局,臺中市政府,農業局,,,,,臺中市動物疾病檢驗件數統計
802,104年臺中市列管建築物,臺中市警察局,臺中市政府,臺中市警察局,,,,,臺中市列管建築物
803,104年臺中市其他天然災害人員傷亡、建物損失,消防局,臺中市政府,消防局,,,,,臺中市其他天然災害人員傷亡、建物損失
804,104年臺中市公民營廢棄物清除處理機構許可統計,環保局,臺中市政府,環保局,,,,,臺中市公民營廢棄物清除處理機構許可統計
805,104年臺中市公司登記現有家數及實收資本額－按行業別分,經濟發展發局,臺中市政府,經濟發展發局,,,,,臺中市公司登記現有家數及實收資本額－按行業別分
806,104年臺中市公司登記家數及實收資本額異動,經濟發展發局,臺中市政府,經濟發展發局,,,,,臺中市公司登記家數及實收資本額異動
807,104年臺中市公共場所一般環境衛生管理工作成果,環境保護局,臺中市政府,環境保護局,,,,,臺中市公共場所一般環境衛生管理工作成果
808,104年臺中市偶蹄類動物口蹄疫疫苗注射措施管理,農業局,臺中市政府,農業局,,,,,臺中市偶蹄類動物口蹄疫疫苗注射措施管理
809,104年臺中市停車位概況－都市計畫區外路外,交通局,臺中市政府,交通局,,,,,車種、收費或不收費
810,104年臺中市停車位概況－都市計畫區內路外,交通局,臺中市政府,交通局,,,,,停車位概況-都市計畫區內路外
811,104年臺中市停車位概況－路邊身心障礙專用停車位,交通局,臺中市政府,交通局,,,,,停車位概況-都市計畫區內路邊-身心障礙專用
812,104年臺中市停車位概況－路邊停車位,交通局,臺中市政府,交通局,,,,,臺中市停車位概況
813,104年臺中市停車位概況－區內路外身心障礙專用停車位,交通局,臺中市政府,交通局,,,,,停車位概況-區內路外身心障礙專用停車位數量
814,104年臺中市使用牌照稅稽徵,地方稅務局,臺中市政府,地方稅務局,,,,,臺中市使用牌照稅稽徵
815,104年臺中市使用牌照稅稅源,地方稅務局,臺中市政府,地方稅務局,,,,,臺中市使用牌照稅稅源
816,104年臺中市事業廢水污染管制情形,環保局,臺中市政府,環保局,,,,,臺中市事業廢水污染管制情形
817,104年臺中市主要觀光遊憩區遊客人次月報表,觀光旅遊局,臺中市政府,觀光旅遊局,,,,,臺中市主要觀光遊憩區遊客人次月報表
818,104年臺中市主要觀光遊憩區遊客人次年報表,觀光旅遊局,臺中市政府,觀光旅遊局,,,,,104年臺中市主要觀光遊憩區遊客人次年報表
819,104年臺中市主要犯罪場所-被害人別,臺中市警察局,臺中市政府,臺中市警察局,,,,,臺中市主要犯罪場所-被害人別
820,104年臺中市主要犯罪場所-嫌疑犯,臺中市警察局,臺中市政府,臺中市警察局,,,,,臺中市主要犯罪場所-嫌疑犯
821,104年臺中市一般旅館業營運報告表,觀光旅遊局,臺中市政府,觀光旅遊局,,,,,臺中市一般旅館業營運報告表
822,104年臺中市一般旅館業查報及取締情形,觀光旅遊局,臺中市政府,觀光旅遊局,,,,,臺中市一般旅館業查報及取締情形
823,104年度臺中市市有財產總目錄,臺中市政府財政局,臺中市政府,財政局,,,,,"104年度臺中市市有財產價值數額，統計數據說明如下：1.公務用財產：1,285億6,107萬2,011元。2.公共用財產：3,134億7,408萬8,337元。3.事業用財產：6億3,043萬1,902元。4.非公用財產：106億4,076萬4,143元。5.全部合計：4,533億635萬6,393元。"
824,104年度臺中市地方總預算附屬單位預算及綜計表(csv),臺中市政府主計處第二科,臺中市政府,主計處,第二科,,,,104年度臺中市地方總預算附屬單位預算及綜計表各項表件(csv)
825,104年度臺中市地方總決算附屬單位決算及綜計表,臺中市政府主計處第二科,臺中市政府,主計處,第二科,,,,104年度臺中市地方總決算附屬單位決算及綜計表
826,104年度臺中市地方總決算-歲入決算情形,臺中市政府財政局,臺中市政府,財政局,,,,,預算數實現數保留數決算數決算數與預算數差異執行率%
827,104年度臺中市地方總決算,臺中市政府主計處第五科,臺中市政府,主計處,第五科,,,,104年度臺中市地方總決算
828,104年度對議員所提地方建設建議事項處理明細表,臺中市政府主計處第一科,臺中市政府,主計處,第一科,,,,104年度對議員所提地方建設建議事項處理明細表
829,104年度公務統計報表,臺中市政府人事處．秘書室資訊股,臺中市政府,人事處,秘書室資訊股,,,,104年度公務統計報表
830,104-105年臺中市登革熱病媒蚊密度調查結果,臺中市政府衛生局,臺中市政府,衛生局,,,,,"調查年度,調查日期,縣市,鄉鎮市區,村里,調查地區分類,機關代表地點,地點補充說明,調查人員種類,調查戶數,調查容器數合計,陽性容器數合計,布氏指數,布氏級數,緯度經度"
831,103年臺中市已登記公私有土地筆數面積 (按區別),臺中市政府地政局‧地籍科,臺中市政府,地政局,地籍科,,,,"公有,私有,公私共有土地面積及筆數"
832,臺中市歷年已登記公私有土地筆數面積,臺中市政府地政局‧地籍科,臺中市政府,地政局,地籍科,,,,"公有,私有,公私共有土地筆數及面積"
833,105年臺中市政府各機關免書證免謄本系統查詢統計表,臺中市政府資訊中心,臺中市政府,資訊中心,,,,,105年免書證免謄本地政、戶政、稅籍系統查詢次數
