編號,資料集名稱,資料來源(部會單位),第一層級,第二層級,第三層級,資料量,下載次數,瀏覽次數,主要欄位,最後更新時間
233,103年火災次數按起火原因分,消防局,高雄市政府,消防局,,1,0,2,行政區、總計、縱火、自殺、燈燭、爐火烹調、敬神掃墓祭祖、菸蒂、電氣因素、機械設備、玩火、烤火、施工不慎、易燃品自燃、瓦斯漏氣或爆炸、化學物品、燃放爆竹、交通事故、天然災害、遺留火種、原因不明、其他,
234,102年火災次數分類及時間,消防局,高雄市政府,消防局,,1,0,2,行政區、建築物、森林田野、車輛、船舶、航空器、其他、零至三時、三至六時、六至九時、九至十二時、十二至十五時、十五至十八時、十八至廿一時、廿一至廿四時,
235,102年火災死傷、財物損失,消防局,高雄市政府,消防局,,1,0,2,行政區、死亡人數_男、死亡人數_女、受傷人數_男、受傷人數_女、自殺、火焰灼燒、有害氣體、跳樓、外物擊中、倒塌物壓到、其他、不明因素、毀損房間數、大型車、小型車、特種車、機車、其他、房屋、財物、保險戶數、保險金額千元,
236,102年起火建築物,消防局,高雄市政府,消防局,,1,0,2,行政區、一至五層、六至十二層、十三至十九層、廿至廿九層、三十層以上、獨立住宅、集合住宅、辦公建築、商業建築、複合建築、倉庫、工廠、寺廟、其他、住宅、營業場所、作業場所、倉庫、空屋或修建中、公共設施、其他,
237,102年火災次數按起火處所分,消防局,高雄市政府,消防局,,1,0,2,行政區、總計、客廳、餐廳、臥室、書房、廚房、浴廁、神龕、陽台、庭院、辦公室、教室、倉庫、機房、攤位、工寮、樓梯間、電梯、管道間、走廊、停車場、騎樓下、路邊、墓地、其他,
238,102年火災次數按起火原因分,消防局,高雄市政府,消防局,,1,0,2,行政區、總計、縱火、自殺、燈燭、爐火烹調、敬神掃墓祭祖、菸蒂、電氣因素、機械設備、玩火、烤火、施工不慎、易燃品自燃、瓦斯漏氣或爆炸、化學物品、燃放爆竹、交通事故、天然災害、遺留火種、原因不明、其他,
239,101年火災次數分類及時間,消防局,高雄市政府,消防局,,1,0,2,行政區、建築物、森林田野、車輛、船舶、航空器、其他、零至三時、三至六時、六至九時、九至十二時、十二至十五時、十五至十八時、十八至廿一時、廿一至廿四時,
240,101年火災死傷、財物損失,消防局,高雄市政府,消防局,,1,0,2,行政區、死亡人數_男、死亡人數_女、受傷人數_男、受傷人數_女、自殺、火焰灼燒、有害氣體、跳樓、外物擊中、倒塌物壓到、其他、不明因素、毀損房間數、大型車、小型車、特種車、機車、其他、房屋、財物、保險戶數、保險金額千元,
241,101年起火建築物,消防局,高雄市政府,消防局,,1,0,2,行政區、一至五層、六至十二層、十三至十九層、廿至廿九層、三十層以上、獨立住宅、集合住宅、辦公建築、商業建築、複合建築、倉庫、工廠、寺廟、其他、住宅、營業場所、作業場所、倉庫、空屋或修建中、公共設施、其他,
242,101年火災次數按起火處所分,消防局,高雄市政府,消防局,,1,0,3,行政區、總計、客廳、餐廳、臥室、書房、廚房、浴廁、神龕、陽台、庭院、辦公室、教室、倉庫、機房、攤位、工寮、樓梯間、電梯、管道間、走廊、停車場、騎樓下、路邊、墓地、其他,
243,101年火災次數按起火原因分,消防局,高雄市政府,消防局,,1,1,4,行政區、總計、縱火、自殺、燈燭、爐火烹調、敬神掃墓祭祖、菸蒂、電氣因素、機械設備、玩火、烤火、施工不慎、易燃品自燃、瓦斯漏氣或爆炸、化學物品、燃放爆竹、交通事故、天然災害、遺留火種、原因不明、其他,
244,105年高雄市爆竹煙火違法取締,消防局,高雄市政府,消防局,,1,2,3,未經許可製造爆竹煙火、製造場所位置構造設備或安全管理不合格、儲存場所位置構造設備或安全管理不合格、販賣場所位置構造設備或安全管理不合格、製造及儲存或販賣場所未投保公共意外責任險、販賣無認可標示爆竹煙火、消防安全設備不合格、施放爆竹煙火兒童施放一般爆竹煙火時未陪同、施放爆竹煙火施放專業爆竹煙火未申請、施放爆竹煙火專業爆竹煙火運出儲存地點未報備、施放專業爆竹煙火未投保公共意外責任險、施放爆竹煙火違反施放作業及人員資格管理辦法、違反施放爆竹煙火自治法規、其他違規取締、移送司法機關偵辦、處罰鍰限期改善、沒入裁處、停業或停工裁處、已收繳罰鍰件次、強制執行件次,
245,107年高雄市土地段名代碼,地政局,高雄市政府,地政局,,1,1,6,行政區、段代碼、段名,
246,107年高雄市公告土地地價,地政局,高雄市政府,地政局,,1,3,12,行政區、地段、地號、公告地價(新台幣元/平方公尺),
247,地價稅課稅面積,財政局,高雄市政府,財政局,,2,2,13,地價稅課稅面積,
248,地價稅課稅地價,財政局,高雄市政府,財政局,,2,6,17,地價稅課稅地價,
249,高雄市開發區土地歷年標售底價,地政局,高雄市政府,地政局,,1,11,42,重劃/區段徵收區、地段、地號、日期價格(元/M2),
250,消防局12導程心電圖機配置清冊,消防局,高雄市政府,消防局,,1,21,82,消防局12導程心電圖機配置清冊,
251,地價稅減免筆數,財政局,高雄市政府,財政局,,2,2,11,地價稅減免筆數,
252,第14任總統副總統選舉大寮區開票統計結果,大寮區公所,高雄市政府,大寮區公所,,1,5,18,第14任總統副總統選舉大寮區開票統計結果,
253,即將屆滿15年未受領保管款歸屬國庫清冊,地政局,高雄市政府,地政局,,1,32,70,編號、保管字號、應受補償人、工程名稱、保管屆期日,
254,違建隊違章建築查報件數,工務局,高雄市政府,工務局,,1,4,25,違建隊違章建築查報件數,
255,違建隊廣告招牌查報總件數,工務局,高雄市政府,工務局,,1,4,21,違建隊廣告招牌查報總件數,
256,105年高雄市政府1999話務中心派工受理前三名機關統計表,研究發展考核委員會,高雄市政府,研究發展考核委員會,,12,64,93,執行機關、派工件數、受理比率(%),
257,105年高雄市政府1999話務中心客服人員滿意度指標,研究發展考核委員會,高雄市政府,研究發展考核委員會,,12,75,91,"問卷樣本數：556""統計起日(來信日期)"",""迄日"",""問題各項滿意度指標 %""",
258,消防局歷年受理市話電話量統計,消防局,高雄市政府,消防局,,1,2,9,年度、總來話次數、總談話時間,
259,消防局歷年受理行動電話量統計,消防局,高雄市政府,消防局,,1,2,9,年度、總來話次數、總談話時間,
260,消防局歷年受理公用電話量統計,消防局,高雄市政府,消防局,,1,2,7,年度、總來話次數、總談話時間,
261,消防局歷年受理其他電話量統計,消防局,高雄市政府,消防局,,1,1,10,年度、總來話次數、總談話時間,
262,消防局歷年受理總電話量統計,消防局,高雄市政府,消防局,,1,4,19,年度、電話量,
263,高雄市政府消防局分隊通訊錄,消防局,高雄市政府,消防局,,1,9,36,單位名稱、地址、電話號碼、傳真號碼,
264,高雄市路口監視器地點,警察局,高雄市政府,警察局,,1,96,616,提供路口監視器之警編、管轄分局、派出所、里別、設置地點等,
265,高雄道路施工影像系統,工務局,高雄市政府,工務局,,0,0,2,,
266,高雄市第2屆市議員選舉第5選舉區開票統計結果,鳥松區公所,高雄市政府,鳥松區公所,,1,3,10,高雄市第2屆市議員選舉第5選舉區開票統計結果,
267,大寮區第二屆里長通訊錄,大寮區公所,高雄市政府,大寮區公所,,1,9,35,大寮區第二屆里長通訊錄,
268,幼教補助向下延伸至2歲,教育局,高雄市政府,教育局,,1,8,25,宣傳海報一張,
269,全國家庭教育諮詢專線宣導,教育局,高雄市政府,教育局,,1,4,16,家庭教育諮詢專線DM,
270,大陸地區人民及法人取得不動產權利統計表,地政局,高雄市政府,地政局,,1,1,6,年度別(民國年)、土地筆數、土地面積(平方公尺)、建物棟數	建物面積(平方公尺),
271,105年度428活動 - 職場安全健康論壇簡報資料,勞工局,高雄市政府,勞工局,,14,139,50,0428務實的自主檢查作為以勞安三級為例,
272,大寮區樂齡學習中心課程,大寮區公所,高雄市政府,大寮區公所,,2,0,26,大寮區樂齡學習中心4-6月課程,
273,代為標售地籍清理土地及建物標售公告清冊,地政局,高雄市政府,地政局,,1,1,9,標號、行政區、段小段、地建號、面積(平方公尺)、使用分區、權利_債權範圍分子、	權利_債權範圍分母、管理人、標讓售底價(新台幣),
274,高雄市寬頻管道,工務局,高雄市政府,工務局,,3,4,4,808020102pipe寬頻管道.dbf,
275,高雄市寬頻手孔,工務局,高雄市政府,工務局,,3,3,5,808020302寬頻手孔.dbf,
276,高雄市寬頻引上管,工務局,高雄市政府,工務局,,3,3,4,808020402寬頻引上管.dbf,
277,高雄市寬頻引上點,工務局,高雄市政府,工務局,,3,3,6,808020502寬頻引上點.dbf,
278,林園公(兒)8-3周邊道路開闢工程,工務局,高雄市政府,工務局,,1,16,42,值,
279,高雄市徵兵及齡男子兵籍調查-教育程度,民政局,高雄市政府,民政局,,2,25,92,"行政區別,兵籍調查人數,大學專科畢業,大學專科肄業,高中高職畢業,高中高職肄業,國中畢業,國中肄業,國小以下,其他,未能繼續徵兵處理原因-羈押或因案入矯正機關執行中,未能繼續徵兵處理原因-身心障礙或重大疾病,未能繼續徵兵處理原因-在學中,未能繼續徵兵處理原因-僑民役男,未能繼續徵兵處理原因-行方不明,未能繼續徵兵處理原因-已服役,未能繼續徵兵處理原因-出境役男,其他狀況",
280,高雄市徵兵及齡男子兵籍調查-民間專長,民政局,高雄市政府,民政局,,2,14,88,"行政區別,駕駛,機械修理,土木建築,電器,化學,五金礦治,測繪,編織縫紉(皮革),醫護,藝工,理髮,外語,方言,游泳騎術,財務,資訊工程,食品,汽車修護,烹飪,美工,印刷,軍樂,攝影,爆破,儀隊,水中機械,重機械操作,機工、廠車、銑磨、沖壓技工,鉗工、鈑金工,電、氣焊工,儀器、光學製造、器材修理技工,電機(力)技工,電話機及有線電修理技工,無線電修理技工,電子儀器修理技工,其他,",
281,89年1000分之1高雄市都市計畫航測地形圖,都市發展局,高雄市政府,都市發展局,,1,61,117,89年1000分之1高雄市都市計畫航測地形圖,
282,99年高雄市(原)地價稅累進起點地價及課稅級距表,財政局,高雄市政府,財政局,,1,19,40,提供99年高雄市(原)地價稅累進起點地價及課稅級距表,
283,勞資爭議調解作業流程圖,勞工局,高雄市政府,勞工局,,1,10,27,勞資爭議調解作業流程,
284,歷年勞資爭議調解成果統計表(自104年起),勞工局,高雄市政府,勞工局,,2,18,38,104年勞資爭議調解成果統計,
285,高雄市A1類道路交通事故肇事、死亡、受傷人數,警察局,高雄市政府,警察局,,1,18,54,A1類肇事人數、死亡人數、受傷人數,
286,高雄市政府勞工局法律諮詢服務時間表,勞工局,高雄市政府,勞工局,,1,8,51,高雄市政府勞工局法律諮詢服務時間表,
287,高雄市政府勞工局勞工歷年申訴服務中心成果(自104年起),勞工局,高雄市政府,勞工局,,2,10,39,104年度高雄市政府勞工局勞工申訴服務中心成果,
288,高雄廣播電臺,新聞局,高雄市政府,新聞局,,0,0,9,,
289,原住民進用情形,人事處,高雄市政府,人事處,,2,16,57,提供105年原住民進用情形,
290,高雄市原住民族產業工坊名單,原住民事務委員會,高雄市政府,原住民事務委員會,,1,11,30,高雄市原住民族產業工坊名單,
291,原住民補助專區,原住民事務委員會,高雄市政府,原住民事務委員會,,1,8,50,原住民補助專區,
292,高雄市原住民族部落大學,原住民事務委員會,高雄市政府,原住民事務委員會,,1,5,32,高雄市原住民族部落大學,
293,公務出國報告,研究發展考核委員會,高雄市政府,研究發展考核委員會,,2,146,80,公務出國報告網頁查詢,
294,無障礙計程車,交通局,高雄市政府,交通局,,1,4,9,無障礙計程車,
295,交通事故斑點圖,警察局,高雄市政府,警察局,,1,35,68,交通事故類別,
296,里活動中心,民政局,高雄市政府,民政局,,2,38,133,里活動中心區別、名稱、地址、座落地號、坐標等資料,
297,高雄市仁武區里活動中心資訊,仁武區公所,高雄市政府,仁武區公所,,1,2,13,活動中心地址、服務電話、開放時間 ,
298,高雄旅遊網-活動資料,觀光局,高雄市政府,觀光局,,1,15,112,"活動結束時間(0000/00/00 00:00:00),活動開始時間(0000/00/00 00:00:00),活動主辦單位,主要活動地點,活動代碼,活動名稱,活動簡介,服務電話，國碼-區碼-電話號碼,景點地址,照片連結網址1,照片說明1,X坐標(WGS84，至小數點第5位),Y坐標,Class1,Class2,Changetime,",
299,高雄市旗山區里長通訊錄,旗山區公所,高雄市政府,旗山區公所,,1,5,42,旗山區第2屆里長通訊錄,
300,社區發展協會通訊錄,旗山區公所,高雄市政府,旗山區公所,,1,9,22,社區發展協會通訊錄,
301,政府行政機關辦公日曆表,人事處,高雄市政府,人事處,,3,103,106,提供政府行政機關辦公日曆表,
302,高雄市政府年度施政計畫目標體系,研究發展考核委員會,高雄市政府,研究發展考核委員會,,2,41,64,提供高雄市政府年度施政計畫網址,
303,高雄市行政概況,研究發展考核委員會,高雄市政府,研究發展考核委員會,,2,67,101,高雄市行政概況,
304,高雄市環保行政概況,環境保護局,高雄市政府,環境保護局,,1,18,44,高雄市環保行政概況,
305,高雄市教育局青少年探索教育中心,教育局,高雄市政府,教育局,,1,8,44,高雄市教育局青少年探索教育中心網站,
306,廣告物設置管理系統,環境保護局,高雄市政府,環境保護局,,1,2,22,廣告物設置管理系統,
307,高雄市AED裝設地點,衛生局,高雄市政府,衛生局,,1,20,85,場所名稱、地址、聯絡電話、地圖定位,
308,高雄720空間影像網,都市發展局,高雄市政府,都市發展局,,1,45,138,提供高雄720空間影像,
309,高雄市遭難漁民數,海洋局,高雄市政府,海洋局,,2,4,7,統計資料背景說明,
310,本區各項農業資料,旗山區公所,高雄市政府,旗山區公所,,3,18,39,105年第4季家畜結果表,
311,農業局暨所屬機關資料盤點表,農業局,高雄市政府,農業局,,1,2,24,農業局暨所屬機關資料盤點表,
312,高雄市愛滋指定醫事機構,衛生局,高雄市政府,衛生局,,2,15,38,"名稱,聯絡電話,地址",
313,高雄市愛滋病匿篩服務點,衛生局,高雄市政府,衛生局,,1,7,30,機構名稱、住址、電話,
314,空氣盒子,環境保護局,高雄市政府,環境保護局,,3,1347,1292,•即時偵測資料:一小時內各地空氣盒子所蒐集的資料。•檔案為gz格式壓縮（下載時請自行加入附檔名.gz)，解壓縮後原始檔案為json格式,
315,高雄市一般空氣品質測站監測統計資料,環境保護局,高雄市政府,環境保護局,,1,22,74,無,
316,高雄市空氣品質淨化區定位資訊,環境保護局,高雄市政府,環境保護局,,1,20,76,"淨化區圖片說明,淨化區圖片編號,",
317,空氣品質手動測站監測數值,環境保護局,高雄市政府,環境保護局,,1,37,77,空氣品質手動測站監測數值,
318,高雄市空氣品質即時通,環保局,高雄市政府,環保局,,0,0,17,,
319,alian-business,阿蓮區公所,高雄市政府,阿蓮區公所,,1,3,11,組織職掌,
320,阿蓮區公所資料盤點表,阿蓮區公所,高雄市政府,阿蓮區公所,,1,9,30,阿蓮區公所資料盤點表,
321,alian-precautionarea,阿蓮區公所,高雄市政府,阿蓮區公所,,1,2,12,阿蓮區里民防災卡,
322,alian-protectarea,阿蓮區公所,高雄市政府,阿蓮區公所,,1,2,10,阿蓮區避難收容場所,
323,alian-Q&A,阿蓮區公所,高雄市政府,阿蓮區公所,,1,3,10,本所業務問答集,
324,服務表單下載,阿蓮區公所,高雄市政府,阿蓮區公所,,1,2,16,服務表單下載,
325,高雄市替代役備役列管人數,民政局,高雄市政府,民政局,,1,6,64,"組別,組別,梯退,零退,遷入,小計,",
326,高雄市生物多樣性都會地圖電子書APP,環保局,高雄市政府,環保局,,0,0,7,,
327,高雄市急救責任醫院分級與急診、AMI、CVA處置時段清冊,消防局,高雄市政府,消防局,,1,10,59,"縣市,醫院簡稱,全名,緊急醫療能力分級,急診時段,AMI-心導管處置,CVAr-TPA處置,備註	",
328,高雄市老屋活化整修及經營補助計畫補助名冊,都市發展局,高雄市政府,都市發展局,,1,19,74,補助對象、補助金額、核定日期,
329,高雄市公告實施都市更新地區計畫,都市發展局,高雄市政府,都市發展局,,1,52,168,提供高雄市公告實施都市更新地區計畫,
330,高雄一指通(雲端版),,高雄市政府,,,0,0,7,,
331,高雄市政府「繁星好康」特約店家優惠資訊一覽表,人事處,高雄市政府,人事處,,1,119,311,提供高雄市政府「繁星好康」特約店家優惠資訊一覽表,
332,高雄市殯葬禮儀服務業備查核准一覽表,民政局,高雄市政府,民政局,,2,17,71,殯葬禮儀服務業者名稱、地址、文號、地址、電話等資料,
333,高雄市政府105年APPS累計下載次數資料表,研究發展考核委員會,高雄市政府,研究發展考核委員會,,8,84,228,"機關名稱,APP名稱,類型,累計下載次數,起始日期,上架方式,備註,",
334,高雄市政府106年APPS累計下載次數資料表,研究發展考核委員會,高雄市政府,研究發展考核委員會,,12,152,352,"機關名稱,APP名稱,類型,累計下載次數,起始日期,上架方式,備註,",
335,高雄市政府APPS資訊,研究發展考核委員會,高雄市政府,研究發展考核委員會,,1,38,196,"AppName,iOS_URL,iOS_ID,Android_URL,Android_ID,ICON,DESC  App名稱，iOS網址，iOS編號，Android網址，Android編號，圖示，描述",
336,高雄市政府社會局福利專家諮詢系統 2.0,社會局,高雄市政府,社會局,,0,0,8,,
337,高雄市水產養殖面積-按魚類別分,海洋局,高雄市政府,海洋局,,2,10,17,統計資料背景說明,
338,高雄市水產加工產品證明標章業者名單,海洋局,高雄市政府,海洋局,,1,16,44,提供高雄市水產加工產品證明標章業者名單,
339,高雄市水產動物疾病檢驗站資訊一覽表,農業局,高雄市政府,農業局,,1,16,44,"地點,住址,電話,時間,備註,",
340,高雄市水產加工廠（場）數,海洋局,高雄市政府,海洋局,,2,7,11,統計資料背景說明,
341,高雄市仁武區國中小學區劃分,仁武區公所,高雄市政府,仁武區公所,,2,24,31,仁武區國小學區里別劃分,
342,ARM自動資源回收機器設置地點、開放時間及回收項目,環境保護局,高雄市政府,環境保護局,,1,40,67,"單位名稱,地址,數量,行政區,使用時間,回收項目,詳細位置,",
343,高雄市空氣品質人工監測站位置,環境保護局,高雄市政府,環境保護局,,1,15,58,高雄市空氣品質人工監測站位置,
344,高雄旅遊網-景點資料,觀光局,高雄市政府,觀光局,,1,404,1029,"景點代碼,景點名稱,Zone,景點介紹,景點簡介,服務電話，國碼-區碼-電話號碼,景點地址,交通資訊,開放時間,照片連結網址1,照片說明1,Gov,X坐標(WGS84，至小數點第5位),Y坐標,Class1,Class2,Level,Website,Parkinginfo_px,Parkinginfo_py,Ticketinfo,Remarks,Changetime,",
345,即時空氣污染物連續自動監測設施(CEMS),環境保護局,高雄市政府,環境保護局,,3,202,431,"工廠管制編號,煙囪,監測項目,時間,測值,狀態碼,",
346,禽流感應變措施,農業局,高雄市政府,農業局,,1,8,27,提供禽流感應變措施,
347,106年楠梓區基本資料表,楠梓區公所,高雄市政府,楠梓區公所,,4,12,36,提供目前楠梓區總人口數、服役人數、低收入戶戶數、中低收入戶戶數、身障人數、老人人數、公寓大廈總數等等。,
348,高雄市民宿資料,觀光局,高雄市政府,觀光局,,1,124,259,"序號,類別,星等,旅宿名稱,縣市,鄉鎮,地址,電話,傳真,房間數,電子郵件,電子郵件,郵遞區號,經度Lng,緯度Lat,資料序號Seq,",
349,底棲生物數據分析,海洋局,高雄市政府,海洋局,,1,11,45,提供底棲生物數據分析,
350,高雄市自行車路線,工務局,高雄市政府,工務局,,4,79,164,高雄市自行車路線,
351,高雄單車地圖,工務局,高雄市政府,工務局,,0,0,9,,
352,高雄市生物多樣性資料庫,環境保護局,高雄市政府,環境保護局,,1,49,107,高雄市生物多樣性資料庫,
353,筆秀排水整治工程(第一期)徵收書圖,水利局,高雄市政府,水利局,,1,5,27,筆秀排水整治工程(第一期)徵收書圖,
354,高雄身障幸福就業,勞工局,高雄市政府,勞工局,,0,0,7,,
355,高雄市公立骨灰(骸)存放設施收費標準,民政局,高雄市政府,民政局,,1,21,40,公立納骨塔行政區、所在里、名稱、樓別、櫃位型、層數、使用費收費標準、說明、備註等,
356,高雄市攤集場名冊,經濟發展局,高雄市政府,經濟發展局,,1,9,52,"編號,行政區,攤販臨時集中場名稱及位置,",
357,茄萣海岸復育及景觀改善工程,水利局,高雄市政府,水利局,,1,7,12,施作緣由，工程內容，效益,
358,旗山地景橋改善工程,水利局,高雄市政府,水利局,,1,4,10,工程緣起，內容，工程效益,
359,大樹污水下水道系統,水利局,高雄市政府,水利局,,1,4,15,工程緣由、內容、效益,
360,阿公店溪流域水質改善與環境營造工程,水利局,高雄市政府,水利局,,1,5,14,工程緣由、內容、效益,
361,水患自主防災社區輔導推動計畫,水利局,高雄市政府,水利局,,1,8,22,工程緣由、內容、效益,
362,抽水站暨水閘門與移動式抽水機維護保養,水利局,高雄市政府,水利局,,1,3,18,工程緣由、內容、效益,
363,年度排水清疏及維護工程,水利局,高雄市政府,水利局,,1,1,10,工程緣由、內容、效益,
364,鳳山溪水岸綠都心營造計畫,水利局,高雄市政府,水利局,,1,9,11,工程緣由、內容、效益,
365,仁武區獅龍溪滯洪池工程,水利局,高雄市政府,水利局,,1,8,33,工程緣由、內容、效益,
366,典寶溪A區滯洪池工程,水利局,高雄市政府,水利局,,1,4,17,工程緣由、內容、效益,
367,北屋排水整治工程,水利局,高雄市政府,水利局,,1,7,21,工程緣起、工程位置及範圍、工程設計原則、工程概要,
368,新光大排截流工程,水利局,高雄市政府,水利局,,1,6,15,工程緣由、內容、效益,
369,污水接管長度與接管率,水利局,高雄市政府,水利局,,1,3,17,歷年用戶接管戶數(戶數)、歷年用戶接管率(%)、歷年管線長度(公里),
370,礫間淨化濕地公園,水利局,高雄市政府,水利局,,1,6,26,礫間、污水區別、位置、座標、設計處理容量,
371,愛河上游水質改善工程(九番埤水質改善),水利局,高雄市政府,水利局,,1,4,13,工程緣由、內容、效益,
372,污水下水道營運管理系統,水利局,高雄市政府,水利局,,1,12,24,工程緣由、內容、效益,
373,鳳山鳥松污水下水道系統,水利局,高雄市政府,水利局,,1,5,11,工程緣由、內容、效益,
374,高雄市污水廠成果展示,水利局,高雄市政府,水利局,,1,3,14,工程緣由、內容、效益,
375,中區污水廠流程處理單元功能提昇,水利局,高雄市政府,水利局,,1,3,11,工程緣由、內容、效益,
376,中區污水廠太陽光電發電系統,水利局,高雄市政府,水利局,,1,9,13,工程緣由、內容、效益,
377,106年高雄市建築物開工統計,工務局,高雄市政府,工務局,,1,3,20,106年8月高雄市建築物開工統計,
378,106年高雄市建築管理各項執照核准件數,工務局,高雄市政府,工務局,,1,3,15,106年8月高雄市建築管理各項執照核准件數,
379,106年高雄市核發建築物使用建照執照統計,工務局,高雄市政府,工務局,,1,4,16,106年8月高雄市核發建築物使用建照執照統計,
380,106年高雄市核發建築物建照及拆除執照統計,工務局,高雄市政府,工務局,,1,3,16,106年8月高雄市核發建築物建照及拆除執照統計,
381,106年高雄市違反建築法令建築罰款處理情形,工務局,高雄市政府,工務局,,1,3,20,106年8月高雄市違反建築法令建築罰款處理情形,
382,騎樓順平,工務局,高雄市政府,工務局,,1,6,21,高雄市騎樓順平概況,
383,閒置空地綠美化,工務局,高雄市政府,工務局,,2,15,34,閒置空地綠美化,
384,建築物立體綠化,工務局,高雄市政府,工務局,,2,11,28,建築物立體綠化成果及分析,
385,100年高雄市一般房屋標準單價表-甲表,財政局,高雄市政府,財政局,,1,8,53,提供100年高雄市一般房屋標準單價表-甲表,
